{
  "schemaVersion": 1,
  "id": "montferret/archive",
  "version": "1.2.0",
  "namespaces": [
    {
      "name": "ARCHIVE",
      "functions": [
        {
          "name": "RUN",
          "signatures": [
            {
              "parameters": [
                {
                  "name": "data",
                  "type": {
                    "kind": "union",
                    "types": [
                      {
                        "kind": "named",
                        "name": "String"
                      },
                      {
                        "kind": "named",
                        "name": "Binary"
                      }
                    ]
                  },
                  "description": "Source content."
                }
              ],
              "description": "Run processes source content.",
              "return": {
                "type": {
                  "kind": "named",
                  "name": "Object"
                },
                "description": "Processed content."
              },
              "throws": [
                {
                  "error": "ParseError",
                  "description": "Source content is malformed."
                }
              ],
              "deprecated": "Use PARSE instead."
            }
          ]
        }
      ]
    }
  ]
}
